{
  "$schema": "https://json-schema.org/draft/2020-12/schema",
  "$id": "https://effortlessmetrics.com/schemas/lintdiff.report.v1.json",
  "title": "lintdiff report v1",
  "type": "object",
  "additionalProperties": false,
  "required": [
    "schema",
    "tool",
    "run",
    "verdict",
    "findings"
  ],
  "properties": {
    "schema": {
      "const": "lintdiff.report.v1"
    },
    "tool": {
      "type": "object",
      "additionalProperties": false,
      "required": [
        "name",
        "version"
      ],
      "properties": {
        "name": {
          "const": "lintdiff"
        },
        "version": {
          "type": "string"
        },
        "commit": {
          "type": "string"
        }
      }
    },
    "run": {
      "type": "object",
      "additionalProperties": false,
      "required": [
        "started_at",
        "ended_at"
      ],
      "properties": {
        "started_at": {
          "type": "string",
          "format": "date-time"
        },
        "ended_at": {
          "type": "string",
          "format": "date-time"
        },
        "duration_ms": {
          "type": "integer",
          "minimum": 0
        },
        "host": {
          "type": "object",
          "additionalProperties": false,
          "properties": {
            "os": {
              "type": "string"
            },
            "arch": {
              "type": "string"
            }
          }
        },
        "git": {
          "type": "object",
          "additionalProperties": false,
          "properties": {
            "repo": {
              "type": "string"
            },
            "base_ref": {
              "type": "string"
            },
            "head_ref": {
              "type": "string"
            },
            "base_sha": {
              "type": "string"
            },
            "head_sha": {
              "type": "string"
            },
            "merge_base": {
              "type": "string"
            }
          }
        }
      }
    },
    "verdict": {
      "type": "object",
      "additionalProperties": false,
      "required": [
        "status",
        "counts"
      ],
      "properties": {
        "status": {
          "type": "string",
          "enum": [
            "pass",
            "warn",
            "fail",
            "skip"
          ]
        },
        "counts": {
          "type": "object",
          "additionalProperties": false,
          "required": [
            "info",
            "warn",
            "error"
          ],
          "properties": {
            "info": {
              "type": "integer",
              "minimum": 0
            },
            "warn": {
              "type": "integer",
              "minimum": 0
            },
            "error": {
              "type": "integer",
              "minimum": 0
            }
          }
        },
        "reasons": {
          "type": "array",
          "items": {
            "type": "string"
          }
        }
      }
    },
    "findings": {
      "type": "array",
      "items": {
        "$ref": "#/$defs/finding"
      }
    },
    "data": {
      "type": "object"
    }
  },
  "$defs": {
    "finding": {
      "type": "object",
      "additionalProperties": false,
      "required": [
        "severity",
        "code",
        "message"
      ],
      "properties": {
        "severity": {
          "type": "string",
          "enum": [
            "info",
            "warn",
            "error"
          ]
        },
        "check_id": {
          "type": "string"
        },
        "code": {
          "type": "string"
        },
        "message": {
          "type": "string"
        },
        "location": {
          "$ref": "#/$defs/location"
        },
        "help": {
          "type": "string"
        },
        "url": {
          "type": "string",
          "format": "uri"
        },
        "fingerprint": {
          "type": "string"
        },
        "data": {
          "type": "object"
        }
      }
    },
    "location": {
      "type": "object",
      "additionalProperties": false,
      "required": [
        "path"
      ],
      "properties": {
        "path": {
          "type": "string"
        },
        "line": {
          "type": "integer",
          "minimum": 1
        },
        "col": {
          "type": "integer",
          "minimum": 1
        }
      }
    }
  }
}
