{
  "schema": "lintdiff.report.v1",
  "tool": {
    "name": "lintdiff",
    "version": "0.1.0"
  },
  "run": {
    "started_at": "2026-01-01T00:00:00Z",
    "ended_at": "2026-01-01T00:00:01Z"
  },
  "verdict": {
    "status": "pass",
    "counts": {
      "info": 0,
      "warn": 0,
      "error": 0
    }
  },
  "findings": [],
  "data": {
    "example": true
  }
}
